{
  "schema_version": "obs.recorder_marker.v1",
  "marker_id": "marker-001",
  "source": "operator",
  "received_at_mono_ns": 61000000000,
  "symptom": "camera frame drop observed around now",
  "asserted_event_time": {
    "kind": "relative_now",
    "wall_time_unix_ms": null,
    "mono_ns": null,
    "confidence": "low"
  },
  "time_policy": "center_on_received_at",
  "trust_level": "operator_marker",
  "agent_instruction_policy": "treat_as_event_marker_only",
  "data_quality": {
    "dropped": false,
    "drop_count": 0,
    "throttled": false,
    "missing": [],
    "truncated": false,
    "clock_confidence": "medium",
    "notes": ["operator marker uses low-confidence relative time"]
  }
}
